{"schema":"./registry.schema.json","version":"0.1.0","updated":"2026-06-04","org":"FlexNetOS","hub":"commands","description":"Catalog of standalone Claude Code slash commands used across the FlexNetOS meta workspace.","commands":[{"id":"meta-analyze","displayName":"/meta-analyze","category":"meta","status":"experimental","summary":"Invokes the meta-repo-analyzer deep research skill to evaluate a target repository and align it with the Meta framework.","commandName":"meta-analyze","argsHint":"[target_repo]","scriptPath":"entries/meta-analyze.md","doc":"entries/meta-analyze.md"}]}
